Procedure,Outcome,Product Line,Product,Author ,Product Line,Article Title,Reference,Outcome/Comments,Abstract,Hyperlink,
TURBT,Obturator Nerve,PK,Resection Loop / Other Electrode,Xishuang,PK,"Comparing the Safety and Efficiency of Conventional Monopolar, Plasmakinetic and Holmium Laser Transurethral Resection of Primary Non muscle Invasive Bladder Tumors. ","Journal of Endourology. January 2010, Volume 24, Number 1 Pp. 69-73","Study shows that both PK-TURBT and HoL-TURBT offer significant advantages to monopolar TURBT, however these technologies did nto demonstrate an obvious advantage over Monopolar in tumor recurrence rate.","Purpose: To compare the safety and efficiency of conventional monopolar, plasmakinetic and holmium laser transurethral resection of bladder tumor (CM-TURBT, PK-TURBT and HoL-TURBT) while managing primary non-muscle invasive bladder cancer.Patients and Methods: From 2005 to 2009, 173 patients with primary non-muscle invasive bladder cancer underwent endoscopic surgery. Among them, 51 patients underwent CM-TURBT, 58 patients underwent PK-TURBT, and 64 patients underwent HoL-TURBT. All patients were divided into three risk groups (low, intermediate, and high) based on the European Association of Urology guidelines and prognostic factors of recurrence. Clinical data, included preoperative, operative, and postoperative management and follow-up, were recorded.Results: Patient demographics and tumor characteristics in all three groups were compared before surgery. There was no significant difference in operative duration among the three groups. Compared with the CM-TURBT group, both PK-TURBT and HoL-TURBT groups had less intraoperative and postoperative complications, including obturator nerve reflex, bladder perforation, as well as bleeding and postoperative bladder irritation. There were no significant differences among the three groups in the transfusion rate and occurrence of urethral strictures. Patients in the PK-TURBT and HoL-TURBT groups had less catheterization and hospitalization time than those in the CM-TURBT group, and there were no significant differences in each risk subgroup as well as the overall recurrence rate among the CM-TURBT, PK-TURBT and HoL-TURBT groups.Conclusions: Both PK-TURBT and HoL-TURBT might prove to be preferable alternatives to CM-TURBT management of non-muscle invasive bladder cancer. PK-TURBT and HoL-TURBT, however, did not demonstrate an obvious advantage over CM-TURBT in tumor recurrence rate.",http://www.liebertonline.com/doi/abs/10.1089/end.2009.0171?journalCode=end,
TURBT,Thermal margin,PK,Resection Loop / Other Electrode,Xishuang,PK,"Comparing the Safety and Efficiency of Conventional Monopolar, Plasmakinetic and Holmium Laser Transurethral Resection of Primary Non muscle Invasive Bladder Tumors. ","Journal of Endourology. January 2010, Volume 24, Number 1 Pp. 69-73","Study shows that both PK-TURBT and HoL-TURBT offer significant advantages to monopolar TURBT, however these technologies did nto demonstrate an obvious advantage over Monopolar in tumor recurrence rate.","Purpose: To compare the safety and efficiency of conventional monopolar, plasmakinetic and holmium laser transurethral resection of bladder tumor (CM-TURBT, PK-TURBT and HoL-TURBT) while managing primary non-muscle invasive bladder cancer.Patients and Methods: From 2005 to 2009, 173 patients with primary non-muscle invasive bladder cancer underwent endoscopic surgery. Among them, 51 patients underwent CM-TURBT, 58 patients underwent PK-TURBT, and 64 patients underwent HoL-TURBT. All patients were divided into three risk groups (low, intermediate, and high) based on the European Association of Urology guidelines and prognostic factors of recurrence. Clinical data, included preoperative, operative, and postoperative management and follow-up, were recorded.Results: Patient demographics and tumor characteristics in all three groups were compared before surgery. There was no significant difference in operative duration among the three groups. Compared with the CM-TURBT group, both PK-TURBT and HoL-TURBT groups had less intraoperative and postoperative complications, including obturator nerve reflex, bladder perforation, as well as bleeding and postoperative bladder irritation. There were no significant differences among the three groups in the transfusion rate and occurrence of urethral strictures. Patients in the PK-TURBT and HoL-TURBT groups had less catheterization and hospitalization time than those in the CM-TURBT group, and there were no significant differences in each risk subgroup as well as the overall recurrence rate among the CM-TURBT, PK-TURBT and HoL-TURBT groups.Conclusions: Both PK-TURBT and HoL-TURBT might prove to be preferable alternatives to CM-TURBT management of non-muscle invasive bladder cancer. PK-TURBT and HoL-TURBT, however, did not demonstrate an obvious advantage over CM-TURBT in tumor recurrence rate.",http://www.liebertonline.com/doi/abs/10.1089/end.2009.0171?journalCode=end,
TURBT,TUR Syndrome,PK,Resection Loop / Other Electrode,Xishuang,PK,"Comparing the Safety and Efficiency of Conventional Monopolar, Plasmakinetic and Holmium Laser Transurethral Resection of Primary Non muscle Invasive Bladder Tumors. ","Journal of Endourology. January 2010, Volume 24, Number 1 Pp. 69-73","Study shows that both PK-TURBT and HoL-TURBT offer significant advantages to monopolar TURBT, however these technologies did nto demonstrate an obvious advantage over Monopolar in tumor recurrence rate.","Purpose: To compare the safety and efficiency of conventional monopolar, plasmakinetic and holmium laser transurethral resection of bladder tumor (CM-TURBT, PK-TURBT and HoL-TURBT) while managing primary non-muscle invasive bladder cancer.Patients and Methods: From 2005 to 2009, 173 patients with primary non-muscle invasive bladder cancer underwent endoscopic surgery. Among them, 51 patients underwent CM-TURBT, 58 patients underwent PK-TURBT, and 64 patients underwent HoL-TURBT. All patients were divided into three risk groups (low, intermediate, and high) based on the European Association of Urology guidelines and prognostic factors of recurrence. Clinical data, included preoperative, operative, and postoperative management and follow-up, were recorded.Results: Patient demographics and tumor characteristics in all three groups were compared before surgery. There was no significant difference in operative duration among the three groups. Compared with the CM-TURBT group, both PK-TURBT and HoL-TURBT groups had less intraoperative and postoperative complications, including obturator nerve reflex, bladder perforation, as well as bleeding and postoperative bladder irritation. There were no significant differences among the three groups in the transfusion rate and occurrence of urethral strictures. Patients in the PK-TURBT and HoL-TURBT groups had less catheterization and hospitalization time than those in the CM-TURBT group, and there were no significant differences in each risk subgroup as well as the overall recurrence rate among the CM-TURBT, PK-TURBT and HoL-TURBT groups.Conclusions: Both PK-TURBT and HoL-TURBT might prove to be preferable alternatives to CM-TURBT management of non-muscle invasive bladder cancer. PK-TURBT and HoL-TURBT, however, did not demonstrate an obvious advantage over CM-TURBT in tumor recurrence rate.",http://www.liebertonline.com/doi/abs/10.1089/end.2009.0171?journalCode=end,
TURP,Bladder irrigation ,PK,Resection Loop / Other Electrode,de Sio,PK,Gyrus Bipolar Versus Standard Monopolar TURP:  A Randomized Prospective Trial,"Journal of Urology  Volume 67, Number 1, 2006","Cath time 72hrs vs. 100 hrs (p<0.05), LOS shorter, improving hemostasis, reducing risk of hyponatremia","ObjectivesTo compare bipolar plasmakinetic (PK) with standard monopolar transurethral resection of the prostate (TURP).MethodsA total of 70 patients were prospectively randomized into two groups: 35 patients underwent PK TURP with the Gyrus device, and 35 patients underwent standard monopolar TURP. We evaluated the time to catheter removal and hospital discharge, operating time, blood loss, postoperative irrigation, complications, urinary flow rates, symptom relief, and postvoid residual volumes.ResultsAt baseline, the study groups were comparable in age, prostate volume, mean prostate-specific antigen value, International Prostate Symptom Score, quality-of-life score, flow rate, and postvoid residual volume. The mean catheterization time was 72 and 100 hours in the PK and standard groups, respectively. This difference was statistically significant (P <0.05), as was the difference in the time to hospital discharge. No difference was found in the mean resection time, amount of resected tissue, or variations in hemoglobin and sodium levels. The improvement in flow rate, postvoid residual volume, International Prostate Symptom Score, and quality-of-life score was comparable between the two groups at 12 months of follow-up.ConclusionsIn our experience, PK TURP showed comparable perioperative results to those obtained with standard TURP, but with more favorable postoperative outcomes. The resection time and blood loss were similar between the two groups, but the need for continuous bladder irrigation after surgery and time to catheter removal and hospital discharge were significantly shorter in the PK group.",http://www.goldjournal.net/article/S0090-4295(05)01129-5/abstract,
TURP,Blood loss,PK,Resection Loop / Other Electrode,Giulianelli,PK,Comparative randomized study on the efficaciousness of treatment of BOO due to BPH in patients having till 100 gr prostate using endoscopic Gyrus prostate resection vs. opsu.,Unmoderated Poster Session  POS-02.71 Urology 70 (Supp 3A) Sept 2007,"Shorter periods of catheterization, hospitalization, retreatments and fewer hemotransfusions.",,http://www.goldjournal.net/article/S0090-4295(07)01545-2/fulltext,
TURP,Blood loss,PK,Resection Loop / Other Electrode,Patankar,PK,PlasmaKinetic Superpulse Transurethral Resection versus Conventional TURP,"Journal of Endourology Volume 20, Number 3, March 2006",Blood loss less in PKTURP vs Monopolar 140 ml vs 283 ml; Cath time less in PK TURP vs Monopolar 18 hrs vs 42 hrs.,"Purpose: To compare the efficacy and safety of the PlasmaKinetic (PK) Superpulse system with that of conventional transurethral resection of the prostate (TURP) in terms of restoration of urinary flow and early postoperative course. Patients and Methods: One hundred five men older than 45 years with lower-urinary tract symptoms associated with benign prostatic hyperplasia (BPH) were randomized, 51 undergoing standard TURP with glycine as the irrigation fluid and 53 TURP with the PK Superpulse system with normal saline as irrigant. The operative time, intraoperative blood loss, catheter time, change in serum electrolytes (particularly sodium), and uroflowmetry and American Urological Association (AUA) Symptom Scores were compared. Results: The blood loss as well as the catheter time observed in the PK Superpulse arm were significantly less than those in the conventional-TURP arm. The mortality rate was 0 in both the arms. The mean operative time was less in the PK Superpulse arm, although not significantly so. Hyponatremia was statistically insignificant. Significant changes were observed in the AUA Scores in both arms. Conclusion: The PK Superpulse system provides faster removal of tissue in a bloodless field with better views and a safer environment of saline irrigation with efficacy comparable to that of conventional TURP. However, further randomized trials with extended follow-up may be needed to better define the role of the PK Superpulse system in treating patients with symptomatic BPH. ",http://www.liebertonline.com/doi/abs/10.1089/end.2006.20.215,
TURP,Blood loss,PK,Resection Loop / Other Electrode,Yang,PK,Gyrus PlasmaSect:  Is it better than Monopolar TURP?,Urol Int 2004:73(3):258-61,"Comparable prostate volume, IPSS/AUA, Qol, Qmax, PVR.  Reduced blood loss, catheterization & LOS","Introduction: This randomized prospective study was conducted to compare the efficacy and safety of the Gyrus Plasmasect loop bipolar transurethral resection of prostate (TURP) and conventional monopolar TURP in the treatment of benign prostatic hyperplasia (BPH). Materials and Methods: A total of 117 men were enrolled in this study. Fifty-eight patients underwent Gyrus Plasmasect TURP and 59 patients underwent monopolar TURP. They were followed up for 3 months after surgery. Results: Significant improvements were seen postoperatively in both the Gyrus and monopolar groups in terms of prostatic volume, International Prostate Symptom Score, quality of life score, peak flow rate, and post-void residual urine volume. However, the degree of improvement was not statistically different between the 2 groups. Significantly less blood loss, shorter postoperative catheterization time and length of hospital stay were seen in the Gyrus group. Conclusions: Gyrus Plasmasect TURP yielded comparable results to monopolar TURP; however, this is only a preliminary study and follow-up is necessary to assess its long-term efficacy.",http://content.karger.com/produktedb/produkte.asp?typ=fulltext&file=UIN2004073003258,
TURP,Cath Time,PK,Resection Loop / Other Electrode,de Sio,PK,Gyrus Bipolar Versus Standard Monopolar TURP:  A Randomized Prospective Trial,"Journal of Urology  Volume 67, Number 1, 2006","Cath time 72hrs vs. 100 hrs (p<0.05), LOS shorter, improving hemostasis, reducing risk of hyponatremia","ObjectivesTo compare bipolar plasmakinetic (PK) with standard monopolar transurethral resection of the prostate (TURP).MethodsA total of 70 patients were prospectively randomized into two groups: 35 patients underwent PK TURP with the Gyrus device, and 35 patients underwent standard monopolar TURP. We evaluated the time to catheter removal and hospital discharge, operating time, blood loss, postoperative irrigation, complications, urinary flow rates, symptom relief, and postvoid residual volumes.ResultsAt baseline, the study groups were comparable in age, prostate volume, mean prostate-specific antigen value, International Prostate Symptom Score, quality-of-life score, flow rate, and postvoid residual volume. The mean catheterization time was 72 and 100 hours in the PK and standard groups, respectively. This difference was statistically significant (P <0.05), as was the difference in the time to hospital discharge. No difference was found in the mean resection time, amount of resected tissue, or variations in hemoglobin and sodium levels. The improvement in flow rate, postvoid residual volume, International Prostate Symptom Score, and quality-of-life score was comparable between the two groups at 12 months of follow-up.ConclusionsIn our experience, PK TURP showed comparable perioperative results to those obtained with standard TURP, but with more favorable postoperative outcomes. The resection time and blood loss were similar between the two groups, but the need for continuous bladder irrigation after surgery and time to catheter removal and hospital discharge were significantly shorter in the PK group.",http://www.goldjournal.net/article/S0090-4295(05)01129-5/abstract,
TURP,Cath Time,PK,Resection Loop / Other Electrode,Gilleran,PK,Safety of Bipolar Electrocautery TURP:  Preliminary Findings,"Journal of Endourology, Sept 2003, Vol 17, No 1, 337-359","Minimal change in serum sodium, chloride, hemoglobin or hemocrit levels.  Hospital stay 1.8 days, catherization 1.6 days","Introduction and Objective With the improvement ofmedical therapy and minimally invasive surgical treatmentsfor benign prostatic hypertrophy, the number oftransurethral resection of prostates (TURP) done duringurology training is decreasing. With fewer TURPS, proficiencyin this basic urologic technique has decreased,leading to longer resection times. Hence, the risk forfluid absorption, water toxicity, and potential electrolyteabnormalities (“TUR syndrome”) using hypotonic irrigantis also increased. We propose to demonstrate thesafety of bipolar electrocautery TURP with the Gyrus PKsystem using normal saline as irrigant.Methods Eighteen males, ages 54-85, underwent salineTURP from June 2002 to April 2003. Serum sodium,chloride, hemoglobin, and hematocrit levels were drawnone hour prior to and following TURP. Resection time,tissue weights on pathologic examination, hospital stay,blood transfusions, and catheter time were recorded andanalyzed.Results Mean age was 69.6 years (range 54-85). Meanpre and post resection sodium levels were 138.9 and138.8 mEq/l (130-142 and 134-143). Mean pre andpost resection chloride levels were 106.5 and 108.9mEq/l (102-114 and 106-116). Mean pre and post resectionhemoglobin and hematocrit levels were 12.9 and39.3 g/dl (8.7-15.2 and 33.7-46.7), and 12.0 and 36.9g/dl (8.2-14.4 and 27.5-43.7), respectively. Mean resectiontime was 74.7 minutes (45-140). Mean tissueweight was 22.0 grams (5-56). Average hospital staywas 1.8 days and average catheter time was 1.6 days.There was no statistically significant difference betweenthe pre and post resection values for any parameter.One patient developed a postoperative urethral stricture,and one patient required repeat endoscopy for persistenthematuria.Conclusion Bipolar TURP using saline is a safe alternative,and is technically no different than traditionalmonopolar TURP.",http://www.liebertonline.com/doi/abs/10.1089/089277903769239090?prevSearch=allfield%253A%2528Gilleran%2BJP%2529&searchHistoryKey=,
TURP,Cath Time,PK,Resection Loop / Other Electrode,Giulianelli,PK,Comparative randomized study on the efficaciousness of treatment of BOO due to BPH in patients having till 100 gr prostate using endoscopic Gyrus prostate resection vs. opsu.,Unmoderated Poster Session  POS-02.71Urology 70 (Supp 3A)  Sept 2007,"Shorter periods of catheterization, hospitalization, retreatments and fewer hemotransfusions.",,http://www.goldjournal.net/article/S0090-4295(07)01545-2/fulltext,
TURP,Cath Time,PK,Resection Loop / Other Electrode,Nuhoglu,PK,PlasmaKinetic Prostate Resection in the Treatment of Benign Prostate Hyperplasia:  Results of 1-year followup.,"International Journal of Urology (2006) 13, 21-24",Cath time 42 vs 75 hrs = shorter LOS,"Aim: In our randomized prospective study, we aimed to evaluate the efficiency of plasmakinetic resection of prostate (PKRP) by comparing the preoperative and postoperative results of the transurethral resection of prostate (TURP) and PKRP techniques which we administered in patients with benign prostate hyperplasia (BPH) in our clinic.Methods: Of 57 patients for whom we thought an operative intervention was necessary, 30 cases in the first group had a TURP and 24 cases in the second group had a PKRP. International prostate symptom scores (I-PSS), uroflowmetry, measurement of residual urine amount and ultrasonography were performed for each patient both preoperatively and postoperatively (first month and first year). Operation times, urethral catheterization times, preoperative and postoperative Hb, Htc and serum Na values of the patients were compared and the complications of the groups were also compared.Results: On first month and first year follow up between the groups, there was no significant statistical difference in I-PSS, maximum flow rate, average flow, residual urine and size of the prostate. The decrease in serum Na level was found to be significantly higher in the TURP group (P < 0.05). The operation times were not significantly different between the groups. While the postoperative catheterization time was 75.7 h in TURP group, it was found to be 42 h in PKRP group and it was clear that catheterization time was significantly shorter (P < 0001).Conclusion: It is obvious that PKRP is as efficient as TURP and it has a similar morbidity. In our opinion, PKRP makes a promising treatment for BPH with its advantages, such as early removal of postoperative urethral catheter, a shorter hospital stay and the absence of TUR syndrome risk.",http://onlinelibrary.wiley.com/doi/10.1111/j.1442-2042.2006.01218.x/abstract,
TURP,Cath Time,PK,Resection Loop / Other Electrode,Patankar,PK,PlasmaKinetic Superpulse Transurethral Resection versus Conventional TURP,"Journal of Endourology Volume 20, Number 3, March 2006",Blood loss less in PKTURP vs Monopolar 140 ml vs 283 ml; Cath time less in PK TURP vs Monopolar 18 hrs vs 42 hrs.,"Purpose: To compare the efficacy and safety of the PlasmaKinetic (PK) Superpulse system with that of conventional transurethral resection of the prostate (TURP) in terms of restoration of urinary flow and early postoperative course. Patients and Methods: One hundred five men older than 45 years with lower-urinary tract symptoms associated with benign prostatic hyperplasia (BPH) were randomized, 51 undergoing standard TURP with glycine as the irrigation fluid and 53 TURP with the PK Superpulse system with normal saline as irrigant. The operative time, intraoperative blood loss, catheter time, change in serum electrolytes (particularly sodium), and uroflowmetry and American Urological Association (AUA) Symptom Scores were compared. Results: The blood loss as well as the catheter time observed in the PK Superpulse arm were significantly less than those in the conventional-TURP arm. The mortality rate was 0 in both the arms. The mean operative time was less in the PK Superpulse arm, although not significantly so. Hyponatremia was statistically insignificant. Significant changes were observed in the AUA Scores in both arms. Conclusion: The PK Superpulse system provides faster removal of tissue in a bloodless field with better views and a safer environment of saline irrigation with efficacy comparable to that of conventional TURP. However, further randomized trials with extended follow-up may be needed to better define the role of the PK Superpulse system in treating patients with symptomatic BPH. ",http://www.liebertonline.com/doi/abs/10.1089/end.2006.20.215,
TURP,Cath Time,PK,Resection Loop / Other Electrode,Tan,PK,BPH:  gyrus loop TURP versus conventional TURP:  prospective trial - 3 yr followup,"Podium Session  POD-06.05  Urology 70 (Supp 3A), Sept 2007",13.6 hours of Catheter time  for PK TURP vs. monopolar,,,
TURP,Cath Time,PK,Resection Loop / Other Electrode,Yang,PK,Gyrus PlasmaSect:  Is it better than Monopolar TURP,Urol Int 2004:73(3):258-61,"PK Loop.  Comparable prostate volume, IPSS/AUA, Qol, Qmax, PVR.  Reduced blood loss, catheterization & LOS","Introduction: This randomized prospective study was conducted to compare the efficacy and safety of the Gyrus Plasmasect loop bipolar transurethral resection of prostate (TURP) and conventional monopolar TURP in the treatment of benign prostatic hyperplasia (BPH). Materials and Methods: A total of 117 men were enrolled in this study. Fifty-eight patients underwent Gyrus Plasmasect TURP and 59 patients underwent monopolar TURP. They were followed up for 3 months after surgery. Results: Significant improvements were seen postoperatively in both the Gyrus and monopolar groups in terms of prostatic volume, International Prostate Symptom Score, quality of life score, peak flow rate, and post-void residual urine volume. However, the degree of improvement was not statistically different between the 2 groups. Significantly less blood loss, shorter postoperative catheterization time and length of hospital stay were seen in the Gyrus group. Conclusions: Gyrus Plasmasect TURP yielded comparable results to monopolar TURP; however, this is only a preliminary study and follow-up is necessary to assess its long-term efficacy.",http://content.karger.com/produktedb/produkte.asp?typ=fulltext&file=UIN2004073003258,
TURP,Cath Time,PK,Resection Loop / Other Electrode,Yoon,PK,Transurethral resection of the prostate with a bipolar tissue management system compared to conventional monopolar resectoscope:  one-year outcome.,Journal of Urology Medline abstract.  Yonsie Med J 2006:  47:715-20,"49 PK TURP, 53 Monopolar TURP:  Duration of catheter use 2.28 days vs. 3.12 days.  Length of Stay 3.52 days vs. 4.27 days","The purpose of the present study was to evaluate the efficacyand safety of bipolar transurethral prostatectomy(TURP) using the GyrusTM PlasmaKinetic System comparedwith conventional monopolar TURP. This study included 102patients with benign prostatic hyperplasia (BPH) who underwentTURP from January 2003 to March 2005. In all, 49consecutive patients had bipolar and 53 had monopolarTURP. All patients were assessed by preoperative andpostoperative International Prostate Symptom Score (IPSS),uroflowmetry, transrectal ultrasonography, operative time,weight of resected tissue, change in serum sodium andhemoglobin, duration of catheter use, length of hospital stay,and complication rates. Significant improvement was seenpostoperatively in both groups, and no difference wasobserved in the resection time, weight of resected tissue,change in serum sodium and hemoglobin, improvement ofIPSS and peak flow rate (Qmax), or complication rates overthe 12-month follow-up in both groups. There was, however,a significant difference in duration of catheter use andhospital stay. Duration of catheter use (2.28 days vs. 3.12days) and hospital stay (3.52 days vs. 4.27 days) were shorterin the bipolar group (p = 0.012 vs. p = 0.034, respectively).Our results demonstrate that bipolar TURP using the GyrusTMPlasma Kinetic System is as effective as conventionalmonopolar TURP with the additional advantage of reducedlength of catheter use and hospital stay. Bipolar TURP is apromising new technique that may prove to be a goodalternative to conventional TURP in the future.",http://synapse.koreamed.org/Synapse/Data/PDFData/0069YMJ/ymj-47-715.pdf,
